{
  "$schema": "https://json-schema.org/draft/2020-12/schema",
  "$id": "https://jocky.dev/schemas/v1/task-status-event.schema.json",
  "title": "TaskStatusEvent",
  "description": "Endpoint-scoped lifecycle event for a task.",
  "type": "object",
  "additionalProperties": false,
  "required": [
    "schema_version",
    "event_id",
    "task_id",
    "case_id",
    "endpoint_id",
    "state",
    "occurred_at",
    "sequence"
  ],
  "properties": {
    "schema_version": {
      "const": "1.0.0"
    },
    "event_id": {
      "type": "string",
      "format": "uuid",
      "pattern": "^[0-9a-fA-F]{8}-[0-9a-fA-F]{4}-[0-9a-fA-F]{4}-[0-9a-fA-F]{4}-[0-9a-fA-F]{12}$"
    },
    "task_id": {
      "type": "string",
      "format": "uuid",
      "pattern": "^[0-9a-fA-F]{8}-[0-9a-fA-F]{4}-[0-9a-fA-F]{4}-[0-9a-fA-F]{4}-[0-9a-fA-F]{12}$"
    },
    "case_id": {
      "type": "string",
      "format": "uuid",
      "pattern": "^[0-9a-fA-F]{8}-[0-9a-fA-F]{4}-[0-9a-fA-F]{4}-[0-9a-fA-F]{4}-[0-9a-fA-F]{12}$"
    },
    "endpoint_id": {
      "type": "string",
      "format": "uuid",
      "pattern": "^[0-9a-fA-F]{8}-[0-9a-fA-F]{4}-[0-9a-fA-F]{4}-[0-9a-fA-F]{4}-[0-9a-fA-F]{12}$"
    },
    "state": {
      "type": "string",
      "enum": [
        "queued",
        "assigned",
        "delivered",
        "running",
        "completed",
        "failed",
        "cancelled",
        "expired"
      ]
    },
    "occurred_at": {
      "type": "string",
      "format": "date-time",
      "pattern": "^\\d{4}-\\d{2}-\\d{2}T\\d{2}:\\d{2}:\\d{2}(?:\\.\\d+)?Z$"
    },
    "sequence": {
      "type": "integer",
      "minimum": 0
    },
    "progress_percent": {
      "type": "integer",
      "minimum": 0,
      "maximum": 100
    },
    "diagnostic": {
      "type": "object",
      "additionalProperties": false,
      "required": ["code", "message", "retryable"],
      "properties": {
        "code": {
          "type": "string",
          "pattern": "^[A-Z][A-Z0-9_]*$",
          "maxLength": 64
        },
        "message": {
          "type": "string",
          "minLength": 1,
          "maxLength": 1024
        },
        "retryable": {
          "type": "boolean"
        }
      }
    }
  },
  "allOf": [
    {
      "if": {
        "properties": {
          "state": {
            "const": "failed"
          }
        },
        "required": ["state"]
      },
      "then": {
        "required": ["diagnostic"]
      }
    }
  ]
}

