{
  "schema_version": "1.0.0",
  "event_id": "33333333-3333-4333-8333-333333333333",
  "task_id": "22222222-2222-4222-8222-222222222222",
  "case_id": "aaaaaaaa-aaaa-4aaa-8aaa-aaaaaaaaaaaa",
  "endpoint_id": "11111111-1111-4111-8111-111111111111",
  "state": "running",
  "occurred_at": "2026-08-30T12:01:00Z",
  "sequence": 3,
  "progress_percent": 25
}

